[
  {"id":"MAT_ARANDUR","name":"Arandur","is_setting_specific":"faerun","substrate":"metal","applies_to":["armor","shield"],
   "pricing_rule":"ADDERS_BY_CATEGORY","category_adders_gp":{"light":2000,"medium":2000,"heavy":2000,"shield":2000},
   "effects":{"resistances":{"sonic":2},"hardness_override":12,"hp_per_inch":30},"source":"Magic of Faerûn (summary)"},
  {"id":"MAT_COPPER_TREATED","name":"Magically Treated Copper","is_setting_specific":"faerun","substrate":"metal","applies_to":["armor","shield"],
   "pricing_rule":"ADDERS_BY_CATEGORY","category_adders_gp":{"light":2000,"medium":2000,"heavy":2000,"shield":2000},
   "effects":{"resistances":{"cold":2},"hardness_override":10,"hp_per_inch":30},"source":"Magic of Faerûn (summary)"},
  {"id":"MAT_DARKSTEEL","name":"Darksteel","is_setting_specific":"faerun","substrate":"metal","applies_to":["armor","shield"],
   "pricing_rule":"ADDERS_BY_CATEGORY","category_adders_gp":{"light":2000,"medium":2000,"heavy":2000,"shield":2000},
   "effects":{"resistances":{"acid":2},"hardness_override":10,"hp_per_inch":30},"source":"Magic of Faerûn (summary)"},
  {"id":"MAT_DLARUN","name":"Dlarun (Icesteel)","is_setting_specific":"faerun","substrate":"metal","applies_to":["armor","shield"],
   "pricing_rule":"ADDERS_BY_CATEGORY","category_adders_gp":{"light":2000,"medium":2000,"heavy":2000,"shield":2000},
   "effects":{"resistances":{"fire":2},"hardness_override":10,"hp_per_inch":30},"exclusions":{"disallow_abilities":["flaming","flaming_burst"]},"source":"Magic of Faerûn (summary)"},
  {"id":"MAT_FEVER_IRON","name":"Fever Iron","is_setting_specific":"faerun","substrate":"metal","applies_to":["armor","shield"],
   "pricing_rule":"ADDERS_BY_CATEGORY","category_adders_gp":{"light":2000,"medium":2000,"heavy":2000,"shield":2000},
   "effects":{"resistances":{"fire":2},"hardness_override":12,"hp_per_inch":30},"exclusions":{"disallow_abilities":["frost","icy_burst"]},"source":"Magic of Faerûn (summary)"},
  {"id":"MAT_HIZAGKUUR","name":"Hizagkuur","is_setting_specific":"faerun","substrate":"metal","applies_to":["armor","shield"],
   "pricing_rule":"ADDERS_BY_CATEGORY","category_adders_gp":{"light":2000,"medium":2000,"heavy":2000,"shield":2000},
   "effects":{"resistances":{"cold":2},"hardness_override":10,"hp_per_inch":30},"notes":"Weapons treated as silver; +1 fire +1 electricity on hit (weapons module).","source":"Magic of Faerûn (summary)"},
  {"id":"MAT_GOLD_TREATED","name":"Magically Treated Gold","is_setting_specific":"faerun","substrate":"metal","applies_to":["armor","shield"],
   "pricing_rule":"ADDERS_BY_CATEGORY","category_adders_gp":{"light":4000,"medium":4000,"heavy":4000,"shield":4000},
   "effects":{"resistances":{"acid":2,"fire":2},"weight_mult":2.0,"asf_delta":10,"max_dex_delta":-2,"acp_delta":-3,"treat_category_heavier_by":1,"hardness_override":10,"hp_per_inch":30},
   "source":"Magic of Faerûn (summary)"},
  {"id":"MAT_ASTRAL_DRIFTMETAL","name":"Astral Driftmetal","is_setting_specific":"faerun","substrate":"metal","applies_to":["armor","shield"],
   "pricing_rule":"FLAT_ADDER","flat_gp":12000,"effects":{},"constraints":{"allowed_categories":["heavy","breastplate","shield"]},"source":"Magic of Faerûn (summary)"},
  {"id":"MAT_LIVING_METAL","name":"Living Metal","is_setting_specific":"faerun","substrate":"metal","applies_to":["armor","shield"],
   "pricing_rule":"ADDERS_BY_CATEGORY","category_adders_gp":{"light":700,"medium":2000,"heavy":4500},
   "effects":{"self_repair_hp_per_minute":1,"hardness_override":12,"hp_per_inch":30},"source":"Magic of Faerûn (summary)"}
]